{
  "id": "c1bc7b0e-df8d-4679-b5ac-3af2a6ed4b47",
  "suiteName": "YH Finance - Conversations List Test Suite",
  "type": "API",
  "baseUrl": "https://yh-finance.p.rapidapi.com",
  "tags": [],
  "testCases": [
    {
      "name": "Get conversations list for AAPL",
      "status": "Not Started",
      "type": "REST",
      "testData": [
        {
          "name": "Conversations List Request",
          "method": "GET",
          "endpoint": "/conversations/list?symbol=AAPL&messageBoardId=finmb_24937&region=US&userActivity=true&sortBy=createdAt&off=0",
          "headers": {
            "x-rapidapi-host": "yh-finance.p.rapidapi.com"
          },
          "preProcess": null,
          "body": "{}",
          "assertions": [
            {
              "type": "statusCode",
              "jsonPath": "$",
              "expected": 200
            }
          ],
          "store": {}
        }
      ],
      "testSteps": []
    }
  ]
}